{"files":[{"path":"packages/testing-runner/tests/fixtures/testing-results/invalid-assertion-truth-table.json","sha256":"31d89d52ffc7ecb7457b34ec8e146794ed72dd307c6a3716b4014ee438e2dc01","size_bytes":193},{"path":"packages/testing-runner/tests/fixtures/testing-results/invalid-case-error-rule.json","sha256":"a9e7833465388b88c25d70f74a48fe48fdbdb8e03c2ecc6b7f9672d378c71f2e","size_bytes":874},{"path":"packages/testing-runner/tests/fixtures/testing-results/invalid-case-outcome.json","sha256":"9e5f4bc0ddd59ee6bd400f2d361296b1e205a3f776a85c7f47fb9cd9c1d9a3d7","size_bytes":814},{"path":"packages/testing-runner/tests/fixtures/testing-results/invalid-case-reason-rule.json","sha256":"f901bf20f2ff3280442ccd387c3d029729b406d4c75054e391a9d5dbac93912d","size_bytes":892},{"path":"packages/testing-runner/tests/fixtures/testing-results/invalid-duration-negative.json","sha256":"c3ff470bb0b0d54689d2fc93a563aa16553ed086081fc3537959e336543ff3bc","size_bytes":818},{"path":"packages/testing-runner/tests/fixtures/testing-results/invalid-duration-over-max.json","sha256":"669ae9349e3389007de7ded6886195ad2365b20dc5f88781630e92bdf09dddb1","size_bytes":824},{"path":"packages/testing-runner/tests/fixtures/testing-results/invalid-hyphen-time-separators.json","sha256":"ef80ff7ebc701000450d05447b7e48ceee4dcaa0e91ed8e8f94e96d092b5ed91","size_bytes":820},{"path":"packages/testing-runner/tests/fixtures/testing-results/invalid-impossible-date.json","sha256":"507484426b0b36f7984f67faf7b69df53889b18900d7db27321dea468bf09116","size_bytes":820},{"path":"packages/testing-runner/tests/fixtures/testing-results/invalid-malformed-digest.json","sha256":"062047d290ba9dfaa48bfc71031d9f10d04cb55554cfaf562806221d711537f4","size_bytes":1006},{"path":"packages/testing-runner/tests/fixtures/testing-results/invalid-missing-required-field.json","sha256":"bdca2bf9a7bfb2d689c620235f6fd4053fc5f20db7098f3505021f58683e666c","size_bytes":170},{"path":"packages/testing-runner/tests/fixtures/testing-results/invalid-multibyte-over-byte-limit.json","sha256":"cdc1c3b451e222e2ce97a4b579c28c749353faf79f3f1a07197dc25b145fbd28","size_bytes":516},{"path":"packages/testing-runner/tests/fixtures/testing-results/invalid-nested-multibyte-over-byte-limit.json","sha256":"6fcf869417450cd8c45a910ce1ce4822f66937bf124c12af512c30601e6aeea3","size_bytes":1244},{"path":"packages/testing-runner/tests/fixtures/testing-results/invalid-overlong-reference-kind.json","sha256":"e95a7c597fd97b4fe8fb0f04d7ffb4538aa99a30c2ffe4f3fd32f5cc18a445c9","size_bytes":252},{"path":"packages/testing-runner/tests/fixtures/testing-results/invalid-required-assertion.json","sha256":"8b03e3af7b00a33d767503549c79453a13e6002a75a1541743faea02af1c47be","size_bytes":812},{"path":"packages/testing-runner/tests/fixtures/testing-results/invalid-set-digest-presence.json","sha256":"19bacdd46398e2ef05b4ea89292fdb87f7ef8da0eddf38b68fc4ea1df9766a39","size_bytes":1846},{"path":"packages/testing-runner/tests/fixtures/testing-results/invalid-unknown-field.json","sha256":"cf8a5c41891d02bc59feb283d08e50bdcf353f4cbec5b90b719ba6e4a901109c","size_bytes":174},{"path":"packages/testing-runner/tests/fixtures/testing-results/valid-assertion.json","sha256":"c2b62f30fdee79f3d678e42e2649e62c1818bfb1855cbdb65354356f38ff7090","size_bytes":238},{"path":"packages/testing-runner/tests/fixtures/testing-results/valid-case-blocked.json","sha256":"979b6f03b0104fe8662e47bacd036d5a204d668beec0ec20880049bdb9afe43f","size_bytes":1004},{"path":"packages/testing-runner/tests/fixtures/testing-results/valid-case-error.json","sha256":"f95d8c4ff993fd9a0b12c1206a0e9146ac374b4f6ca1b0382e57121cc1e9af9c","size_bytes":1050},{"path":"packages/testing-runner/tests/fixtures/testing-results/valid-case-failed.json","sha256":"e1892f5e6a741b2a42345f78784aefa17e02c8d255e0c2d14f0bb2bfa1e552fc","size_bytes":1188},{"path":"packages/testing-runner/tests/fixtures/testing-results/valid-case-lost.json","sha256":"5100d500617cf850f3acf6d9a12fd4577d2fa0bfb98bc8d5b02ab7cd54f98a6c","size_bytes":984},{"path":"packages/testing-runner/tests/fixtures/testing-results/valid-case-not-applicable.json","sha256":"48ba24d76331fd22931ab6d47051bedd7d1b35094400a92a542c4fec3fa76d1c","size_bytes":1027},{"path":"packages/testing-runner/tests/fixtures/testing-results/valid-case-passed.json","sha256":"c7aa204f472f6ca22959be14c49b0d7d757eba4e193dda2efa2c087295efe293","size_bytes":1175},{"path":"packages/testing-runner/tests/fixtures/testing-results/valid-case-skipped.json","sha256":"c2386e2a886863c6eb94859fde3c710dfcc30f0cbd035dc40438a7580018d250","size_bytes":997},{"path":"packages/testing-runner/tests/fixtures/testing-results/valid-case-year-zero.json","sha256":"b012d92a0e8630c575e95e591ec8da5641b249d189701ec0184a20e4dd7797e1","size_bytes":963},{"path":"packages/testing-runner/tests/fixtures/testing-results/valid-observation.json","sha256":"a27f087b6cd10056941db3817ee33b4aca53b835a0ee2e14d13381b9e9487697","size_bytes":228},{"path":"packages/testing-runner/tests/fixtures/testing-results/valid-result-set-evidence-manifest.json","sha256":"e546f417a0f696862547b2e1049f0f81a70706d0413edc70f6d71b76384f1096","size_bytes":1486},{"path":"packages/testing-runner/tests/fixtures/testing-results/valid-result-set.json","sha256":"5ddabd1553c29e9ba735b3312888a7604774424473b3f0f206ab11746fa30e00","size_bytes":1764},{"path":"schema-fixtures/indexes/testing-results.json","sha256":"0b66fdadc731c99c583601a9ebaf699edd399533ee40c84274fec1920f401892","size_bytes":5613}],"fixture_set_sha256":"db37186dab28fe86903360c071023c8581c75e84f996d4956ae11fbd791555ed","schema":"testing-schema-fixture-set.v1","schema_id":"https://chronoaiproject.github.io/fkst-packages-testing/schemas/testing-case-result-set.v2.schema.json"}
