{"files":[{"path":"packages/testing-runner/tests/fixtures/testing-result-authority-receipt.v1/invalid-digest.json","sha256":"4f7e534afd406d1701c3c6fed1d97c029aa8c06de2dcbde224dbd51aa6a9634f","size_bytes":809},{"path":"packages/testing-runner/tests/fixtures/testing-result-authority-receipt.v1/invalid-unknown-field.json","sha256":"0f5fba0cfc35e1b45dbb53d63e0d527fd48f86680c80c75bc2b5e1fbe8bc39ce","size_bytes":133},{"path":"packages/testing-runner/tests/fixtures/testing-result-authority-receipt.v1/valid-assertion-failure.json","sha256":"64460cac642694fb6336b85d43db8e83cd322749f051ce52e16ce0af13d184e6","size_bytes":1865},{"path":"packages/testing-runner/tests/fixtures/testing-result-authority-receipt.v1/valid-cancelled.json","sha256":"80f81d1bedbc41ee6751dd034bf819dcab56527d33827f804df7bf4eb3bce969","size_bytes":1857},{"path":"packages/testing-runner/tests/fixtures/testing-result-authority-receipt.v1/valid-infrastructure-failure.json","sha256":"0309f5b98e7a3c18bcc92a6d32733aee09db55fe029b9bc0758da73bf4460cb7","size_bytes":1870},{"path":"packages/testing-runner/tests/fixtures/testing-result-authority-receipt.v1/valid-lost-or-inconclusive.json","sha256":"81eb91ed5ab3c803f980c0a9c8a0c4ce8890a433592de9d57e97ac79c229e67d","size_bytes":1868},{"path":"packages/testing-runner/tests/fixtures/testing-result-authority-receipt.v1/valid-passed.json","sha256":"a3234613e4c5625d949e1aab994756543e2397626348f1cb56bab2930d1309a0","size_bytes":1854},{"path":"schema-fixtures/indexes/testing-result-authority-receipt.v1.json","sha256":"4196f9adaf5d055d4bb66c6b0c7cbff8cedbab9aee0256069f3a535a1dfc2467","size_bytes":1546}],"fixture_set_sha256":"f91051f5c3a5ea941f331db99bd74fa8a6c039e5b69a98401dcf49cdf5d64fdf","schema":"testing-schema-fixture-set.v1","schema_id":"https://chronoaiproject.github.io/fkst-packages-testing/schemas/testing-result-authority-receipt.v1.schema.json"}
