{"files":[{"path":"packages/testing-runner/tests/fixtures/testing-package-release.v1/invalid-unknown-field.json","sha256":"a61105aef195ed2cb4b2127f9bab15783951cf07daa9f5fc6c8c5c1c7a5733f6","size_bytes":2338},{"path":"packages/testing-runner/tests/fixtures/testing-package-release.v1/valid.json","sha256":"44aab2355291ae1a9f52aba38d12630817a1901813c74c9e54482fc24956557d","size_bytes":2323},{"path":"schema-fixtures/indexes/testing-package-release.v1.json","sha256":"b79d8ee1f1ee0d72ceaa116f8d0f6b359b7d7f6b559e77c9fe786f53b5283e9c","size_bytes":461}],"fixture_set_sha256":"3609c06a27dc3bb4f77223609bac8ce69373f13c6a9cec5b57fa819534e3e2c8","schema":"testing-schema-fixture-set.v1","schema_id":"https://chronoaiproject.github.io/fkst-packages-testing/schemas/testing-package-release.v1.schema.json"}
