{"files":[{"path":"packages/testing-runner/tests/fixtures/testing-evidence-manifest.v1/invalid-empty-entries.json","sha256":"2a530a2f2af1c31661352811781bdf286db4a55935e10687c745a5c98c92b475","size_bytes":796},{"path":"packages/testing-runner/tests/fixtures/testing-evidence-manifest.v1/invalid-hyphen-time-separators.json","sha256":"404f55e22bedbf356ccf7da5d8c4526b2dd3f5573ad723d46141aa758a4ccf1c","size_bytes":3436},{"path":"packages/testing-runner/tests/fixtures/testing-evidence-manifest.v1/invalid-impossible-date.json","sha256":"730b0884781129f9feadd577c316d5bc8ae4b2d096ca845928d930b6b4b5bc5a","size_bytes":3436},{"path":"packages/testing-runner/tests/fixtures/testing-evidence-manifest.v1/invalid-malformed-artifact-ref.json","sha256":"3bd11bf9340b29b04ba657c5e21f08c1f23b17ffb1c9f7b08a07a16c13d00694","size_bytes":1675},{"path":"packages/testing-runner/tests/fixtures/testing-evidence-manifest.v1/invalid-malformed-digest.json","sha256":"b5c43ad0dad5306a968ff1d4d581696839fd222764c09035ba895a44c17f70eb","size_bytes":1674},{"path":"packages/testing-runner/tests/fixtures/testing-evidence-manifest.v1/invalid-malformed-timestamp.json","sha256":"8480c7362c215fa22d1f3c78d98a7bcd828fb730b7e32893eb1db06bae3b2fc5","size_bytes":1674},{"path":"packages/testing-runner/tests/fixtures/testing-evidence-manifest.v1/invalid-missing-required-field.json","sha256":"7539ef20d2bb36405b67c7e98f335d1c30df0ea76e2b3853ef6271880dc982db","size_bytes":1589},{"path":"packages/testing-runner/tests/fixtures/testing-evidence-manifest.v1/invalid-multibyte-over-byte-limit.json","sha256":"dea9359fe974c683e74c54e08d16d55e4908af8c2445d232d718e31634069db3","size_bytes":3595},{"path":"packages/testing-runner/tests/fixtures/testing-evidence-manifest.v1/invalid-overlong-evidence-id.json","sha256":"2f154b6a1ec24149935101e3962e70a9c684bc9166627c3ff6526c2fedb03718","size_bytes":1843},{"path":"packages/testing-runner/tests/fixtures/testing-evidence-manifest.v1/invalid-overlong-reference-kind.json","sha256":"7d4a48fcfe7073127e0eac1d0ef41cad0f7d91125e98778a3ffc0993b8359ced","size_bytes":1768},{"path":"packages/testing-runner/tests/fixtures/testing-evidence-manifest.v1/invalid-role-media-mismatch.json","sha256":"cf3982ccf6508b1189485f5cf40b53cc29f6c13c0f84fcbf548fda6dc29cb4f4","size_bytes":1674},{"path":"packages/testing-runner/tests/fixtures/testing-evidence-manifest.v1/invalid-size-bytes-fractional.json","sha256":"4a19b713a15c1a06325d7268afed183faf7effd77ad76558e65a34eea7f70f89","size_bytes":1674},{"path":"packages/testing-runner/tests/fixtures/testing-evidence-manifest.v1/invalid-size-bytes-negative.json","sha256":"02ed49adb3644f6ae0e79f955219a865b4642c957dc7ac06b1aa6c8c19bdd315","size_bytes":1673},{"path":"packages/testing-runner/tests/fixtures/testing-evidence-manifest.v1/invalid-size-bytes-over-max.json","sha256":"da41b56a832713ff320b2d92cc11ff0a52d60131d97923df02d05909ca8b46b0","size_bytes":1681},{"path":"packages/testing-runner/tests/fixtures/testing-evidence-manifest.v1/invalid-too-many-entries.json","sha256":"459e2f0ddd101f8675f2e0647a45c5e4111fdf89581f073a329179cdf12ee481","size_bytes":3368},{"path":"packages/testing-runner/tests/fixtures/testing-evidence-manifest.v1/invalid-unknown-field.json","sha256":"2cce7b7cc4769858e118b17f9fbda880bc04165abc8b0bf478aa2dd4c3ac564e","size_bytes":1696},{"path":"packages/testing-runner/tests/fixtures/testing-evidence-manifest.v1/invalid-unsupported-policy-status.json","sha256":"95878fd16c6c62012e8fc67574b8ab2501f99ba46e8ff9d84a95cbbe9f76a7a6","size_bytes":1673},{"path":"packages/testing-runner/tests/fixtures/testing-evidence-manifest.v1/invalid-unsupported-role.json","sha256":"2f52d81f2cf6d149c19ed2764babaee86a74a1835418c3bda4559ac53035ff02","size_bytes":1669},{"path":"packages/testing-runner/tests/fixtures/testing-evidence-manifest.v1/invalid-unsupported-sensitivity.json","sha256":"12ebd693cb285e03ef860050dd395ce793f494df74baf829dddf257244e5e6e0","size_bytes":1672},{"path":"packages/testing-runner/tests/fixtures/testing-evidence-manifest.v1/valid-year-zero.json","sha256":"e5e703de51a975bb3a0e9b6e63d385c39d09f3c568c218cf5eb006a40af7badc","size_bytes":3436},{"path":"packages/testing-runner/tests/fixtures/testing-evidence-manifest.v1/valid.json","sha256":"ff675c73daa364f0696f5f2e0cbcea28852d7775613b3e1ad92a198459b61bf4","size_bytes":3436},{"path":"schema-fixtures/indexes/testing-evidence-manifest.v1.json","sha256":"f3cb54d651e7ac14b4291060ac5df138ad0c8bd4ebe5a08181ae710df8734571","size_bytes":4570}],"fixture_set_sha256":"b126d694ddb88e2b2552de1acc86f03d7211b10f54fd8cc09a049f70dfeb1231","schema":"testing-schema-fixture-set.v1","schema_id":"https://chronoaiproject.github.io/fkst-packages-testing/schemas/testing-evidence-manifest.v1.schema.json"}
