{"files":[{"path":"schema-fixtures/indexes/publication-meta.json","sha256":"c7f8167fbf8b7dab277fe4eb4335142ffa10cea2abda229e4e4548282e6b8c67","size_bytes":1081},{"path":"schema-fixtures/publication-meta/invalid-unknown-field.json","sha256":"e8e5d7c6e389bf0d8e0e9aca18f466fdb9c904c4c27a033ce116dda09c8232f3","size_bytes":140},{"path":"schema-fixtures/publication-meta/valid-catalog.json","sha256":"36e0572d5b7cdd74e8cabd3bd62ff29f6bb9f92973577cdb45dab2a3475cb9f2","size_bytes":717},{"path":"schema-fixtures/publication-meta/valid-fixture-set.json","sha256":"d27bff0453dba6284f4709bf2c8cda4da6bcd66c7b9038e48ef570ecd34fef0c","size_bytes":392},{"path":"schema-fixtures/publication-meta/valid-fixtures.json","sha256":"c2b73a556a8926a6357915909a4ae48784bbaf5e74b4b22cd73d7444017f7abd","size_bytes":329},{"path":"schema-fixtures/publication-meta/valid-release.json","sha256":"65b40dbe3bebc70b1faf928e59c0beadd5b60e44216eaed326a042d13cfbee25","size_bytes":669}],"fixture_set_sha256":"3565206950b6c792b2968cc9412203103d519a543ca98737d2f051f5370e3691","schema":"testing-schema-fixture-set.v1","schema_id":"https://chronoaiproject.github.io/fkst-packages-testing/schemas/testing-schema-fixtures.v1.schema.json"}
