{"files":[{"path":"schema-fixtures/indexes/testing-result-reason.v1.json","sha256":"1243e92a06da01b148e232fc888bf62a928e06e836246465bae5c00b2a006227","size_bytes":6533},{"path":"schema-fixtures/testing-result-reason.v1/invalid-cross-kind.json","sha256":"419c3aaf5dd7b6c7858de970e42fef37920dde636281966a9caeeaf92fbec917","size_bytes":142},{"path":"schema-fixtures/testing-result-reason.v1/invalid-missing-field.json","sha256":"103b625d34f1de4c46cf545cbee92cac2d842361c16e557ccbc20fe687206938","size_bytes":118},{"path":"schema-fixtures/testing-result-reason.v1/invalid-unknown-code.json","sha256":"ed571e040b56b4886c0f024783a6ebfbcf4610456dd8b4d22056a8f4cd348283","size_bytes":142},{"path":"schema-fixtures/testing-result-reason.v1/invalid-unknown-field.json","sha256":"f040aaa1956d3b91babf868538aab4d4f5605fa0b1bbdbde2f3755938d2374af","size_bytes":160},{"path":"schema-fixtures/testing-result-reason.v1/invalid-wrong-type.json","sha256":"808fd28171824d5fc1daa34d5a139edb375689bf9960ab3ad34e7f1235753b3c","size_bytes":124},{"path":"schema-fixtures/testing-result-reason.v1/valid-error-browser-action-invalid.json","sha256":"48a6ee2ca4f4d30478928c70ca241c82c559ac9981e7d43116e73aeefbff3d1d","size_bytes":162},{"path":"schema-fixtures/testing-result-reason.v1/valid-error-browser-controller-interrupted.json","sha256":"e6eaa98c6938d350b4838e2cdcc68c67e8e98750807dea262642199cb9df424d","size_bytes":178},{"path":"schema-fixtures/testing-result-reason.v1/valid-error-browser-observation-failed.json","sha256":"659691c302d0067c899429c61aa55cb1655cd2bc77f0aafd368c4e139bf889ce","size_bytes":170},{"path":"schema-fixtures/testing-result-reason.v1/valid-error-browser-step-failed.json","sha256":"065a669f60346d056d825db6a72e183bc807bb46c0e9cb241848e2917aba52d2","size_bytes":156},{"path":"schema-fixtures/testing-result-reason.v1/valid-error-callback-verification-failed.json","sha256":"103eb14bce52702f36775f13a7601d7f4c9795372563626e847182da599e6509","size_bytes":174},{"path":"schema-fixtures/testing-result-reason.v1/valid-error-environment-session-issue.json","sha256":"9253ede448d18d09801217584e590f0435ae1d279b76e195e85b186711efc60f","size_bytes":168},{"path":"schema-fixtures/testing-result-reason.v1/valid-error-harness-tooling-issue.json","sha256":"904cb1b059692da5dd6b846e389ffdc2270ca4278c221b3d2131e0a7c4f43cbe","size_bytes":160},{"path":"schema-fixtures/testing-result-reason.v1/valid-error-invalid-browser-completion.json","sha256":"77f95f025386b9af8abb57b9442d00912f9b83f787a02c9accbc0c0ef5775cb5","size_bytes":170},{"path":"schema-fixtures/testing-result-reason.v1/valid-error-provider-timeout.json","sha256":"a9a6229b770d4949e77c60ace0653ec8759aa6b559bf1d53e55cfae2b12338e6","size_bytes":150},{"path":"schema-fixtures/testing-result-reason.v1/valid-error.json","sha256":"ab8ad876193b02e280ae1d15cafe1c331a7b617005885d09eef202b92d269681","size_bytes":139},{"path":"schema-fixtures/testing-result-reason.v1/valid-non-execution-browser-step-budget-exhausted.json","sha256":"23f825ec4f65192bbd196c2cd5205114fbc462ba430835d98f7a2b98897b25cf","size_bytes":192},{"path":"schema-fixtures/testing-result-reason.v1/valid-non-execution-browser-time-budget-exhausted.json","sha256":"11bdd19ec91ed4b35e84bd457e15461d527871140c2b258731095e3b539f1f0b","size_bytes":192},{"path":"schema-fixtures/testing-result-reason.v1/valid-non-execution-case-not-selected.json","sha256":"7ace7a3d84656cde674aef47300b30c4a540f8b1a9e5a7a35d3543873bf5ec73","size_bytes":168},{"path":"schema-fixtures/testing-result-reason.v1/valid-non-execution-data-fixture-gap.json","sha256":"97a3c5dbb1c3d19ab9f6772e217a06170840a3eb82dd5400d21b5a044cf8fe29","size_bytes":166},{"path":"schema-fixtures/testing-result-reason.v1/valid-non-execution-execution-lost-between-action-and-assertion.json","sha256":"f0f5e891d75125af9e0840e891f446e3cfe640c2e86d37f80727e249d7f5d5e8","size_bytes":220},{"path":"schema-fixtures/testing-result-reason.v1/valid-non-execution-not-executed-risk.json","sha256":"08f9105e21513e172fa5eee23f1bfe276e4dd805ad54d3017c0c747eff43eb24","size_bytes":168},{"path":"schema-fixtures/testing-result-reason.v1/valid-non-execution-platform-not-applicable.json","sha256":"91f5caaabcca18a1c4ed7355bd1de4b0fc4bac4248145e45190107433480c5d8","size_bytes":180},{"path":"schema-fixtures/testing-result-reason.v1/valid-non-execution-policy-deferred.json","sha256":"eb632a1cdb81f7fe4da9603ecf2d7a9bace56935872eec9b3510cb99de81d78d","size_bytes":164},{"path":"schema-fixtures/testing-result-reason.v1/valid-non-execution-precondition-unavailable.json","sha256":"29576e8c51a9f611f896193a397b38beec0cbcb244315b27a506bcd4aa970582","size_bytes":182},{"path":"schema-fixtures/testing-result-reason.v1/valid-non-execution-repeated-ai-action.json","sha256":"5164dee8402f9a2cb3a9831efb687b7b4e02daa64b184eb02261330b71164798","size_bytes":170},{"path":"schema-fixtures/testing-result-reason.v1/valid-non-execution-runner-disconnected.json","sha256":"3e3cea9d1ebfd2ef867422fb2501052095b978eceafc759cfb44883c32fbcdde","size_bytes":172},{"path":"schema-fixtures/testing-result-reason.v1/valid-non-execution-unsafe-browser-observation.json","sha256":"f23a7e40c8d6df384ac4b1eeb94c181ad4fb3af8f5eb62b0f025f7921abc17b6","size_bytes":186},{"path":"schema-fixtures/testing-result-reason.v1/valid-non-execution.json","sha256":"ff05fff8f08ad1f7f3f3e64ba59acab259d8f3be3e8ca72ffebcfdd106f490fd","size_bytes":156}],"fixture_set_sha256":"a4cd1b4332f3e1e088a76fafc56fd97ec9af82ab303214a2dfb9133d4284e394","schema":"testing-schema-fixture-set.v1","schema_id":"https://chronoaiproject.github.io/fkst-packages-testing/schemas/testing-result-reason.v1.schema.json"}
